{
  "$schema": "./theme.schema.json",
  "schemaVersion": 1,
  "id": "nord",
  "name": "Nord",
  "appearance": "dark",
  "tokens": {
    "background": "#2e3440",
    "backgroundSecondary": "#3b4252",
    "backgroundTertiary": "#4c566a",
    "surface": "#2e3440",
    "surfaceHover": "#434c5e",
    "surfaceActive": "#4c566a",
    "border": "#5e636d",
    "borderStrong": "#d8dee9",
    "textPrimary": "#eceff4",
    "textSecondary": "#d8dee9",
    "textTertiary": "#d8dee9",
    "textOnAccent": "#000000",
    "accent": "#88c0d0",
    "accentHover": "#80b4c4",
    "accentSurface": "#4c566a",
    "focusRing": "#88c0d0",
    "error": "#bf616a",
    "errorSurface": "#2e3440",
    "success": "#a3be8c",
    "successSurface": "#2e3440",
    "warning": "#ebcb8b",
    "warningSurface": "#2e3440",
    "info": "#81a1c1",
    "infoSurface": "#2e3440",
    "backdrop": "#3b4252b3",
    "shadow": "#00000040",
    "folder": "#88c0d0",
    "fileImage": "#a3be8c",
    "fileVideo": "#d08770",
    "fileAudio": "#b48ead",
    "fileCode": "#81a1c1",
    "fileArchive": "#ebcb8b",
    "filePdf": "#bf616a",
    "fileText": "#d8dee9",
    "previewCheckerboardLight": "#434c5e",
    "previewCheckerboardDark": "#2e3440"
  }
}
