{
  "$schema": "./theme.schema.json",
  "schemaVersion": 1,
  "id": "alucard",
  "name": "Alucard",
  "appearance": "light",
  "tokens": {
    "background": "#fffbeb",
    "backgroundSecondary": "#efeddc",
    "backgroundTertiary": "#cfcfde",
    "surface": "#fffbeb",
    "surfaceHover": "#ece9df",
    "surfaceActive": "#cfcfde",
    "border": "#c7c4b8",
    "borderStrong": "#5f5a42",
    "textPrimary": "#1f1f1f",
    "textSecondary": "#5f5a42",
    "textTertiary": "#5f5a42",
    "textOnAccent": "#ffffff",
    "accent": "#644ac9",
    "accentHover": "#6d55cc",
    "accentSurface": "#cfcfde",
    "focusRing": "#644ac9",
    "error": "#cb3a2a",
    "errorSurface": "#fffbeb",
    "success": "#14710a",
    "successSurface": "#fffbeb",
    "warning": "#846e15",
    "warningSurface": "#fffbeb",
    "info": "#036a96",
    "infoSurface": "#fffbeb",
    "backdrop": "#efeddcb3",
    "shadow": "#00000040",
    "folder": "#644ac9",
    "fileImage": "#14710a",
    "fileVideo": "#a34d14",
    "fileAudio": "#a3144d",
    "fileCode": "#036a96",
    "fileArchive": "#846e15",
    "filePdf": "#cb3a2a",
    "fileText": "#5f5a42",
    "previewCheckerboardLight": "#fffbeb",
    "previewCheckerboardDark": "#cfcfde"
  }
}
