{
  "$schema": "./theme.schema.json",
  "schemaVersion": 1,
  "id": "solarized-dark",
  "name": "Solarized Dark",
  "appearance": "dark",
  "tokens": {
    "background": "#002b36",
    "backgroundSecondary": "#073642",
    "backgroundTertiary": "#094352",
    "surface": "#002b36",
    "surfaceHover": "#073642",
    "surfaceActive": "#094352",
    "border": "#284b53",
    "borderStrong": "#9daaac",
    "textPrimary": "#9eaaaa",
    "textSecondary": "#9daaac",
    "textTertiary": "#9daaac",
    "textOnAccent": "#000000",
    "accent": "#268bd2",
    "accentHover": "#2483c5",
    "accentSurface": "#094352",
    "focusRing": "#2a8dd3",
    "error": "#dc322f",
    "errorSurface": "#002b36",
    "success": "#859900",
    "successSurface": "#002b36",
    "warning": "#b58900",
    "warningSurface": "#002b36",
    "info": "#268bd2",
    "infoSurface": "#002b36",
    "backdrop": "#073642b3",
    "shadow": "#00000040",
    "folder": "#268bd2",
    "fileImage": "#859900",
    "fileVideo": "#cb4b16",
    "fileAudio": "#6c71c4",
    "fileCode": "#268bd2",
    "fileArchive": "#b58900",
    "filePdf": "#dc322f",
    "fileText": "#9daaac",
    "previewCheckerboardLight": "#073642",
    "previewCheckerboardDark": "#002b36"
  }
}
