{
  "$schema": "./theme.schema.json",
  "schemaVersion": 1,
  "id": "one-dark",
  "name": "One Dark",
  "appearance": "dark",
  "tokens": {
    "background": "#282c34",
    "backgroundSecondary": "#21252b",
    "backgroundTertiary": "#353b45",
    "surface": "#282c34",
    "surfaceHover": "#2c313a",
    "surfaceActive": "#353b45",
    "border": "#494e57",
    "borderStrong": "#9fa4af",
    "textPrimary": "#abb2bf",
    "textSecondary": "#9fa4af",
    "textTertiary": "#9fa4af",
    "textOnAccent": "#000000",
    "accent": "#61afef",
    "accentHover": "#5ba4e1",
    "accentSurface": "#353b45",
    "focusRing": "#61afef",
    "error": "#e06c75",
    "errorSurface": "#282c34",
    "success": "#98c379",
    "successSurface": "#282c34",
    "warning": "#e5c07b",
    "warningSurface": "#282c34",
    "info": "#56b6c2",
    "infoSurface": "#282c34",
    "backdrop": "#21252bb3",
    "shadow": "#00000040",
    "folder": "#61afef",
    "fileImage": "#98c379",
    "fileVideo": "#d19a66",
    "fileAudio": "#c678dd",
    "fileCode": "#56b6c2",
    "fileArchive": "#e5c07b",
    "filePdf": "#e06c75",
    "fileText": "#9fa4af",
    "previewCheckerboardLight": "#2c313a",
    "previewCheckerboardDark": "#282c34"
  }
}
