{
  "$schema": "./theme.schema.json",
  "schemaVersion": 1,
  "id": "one-light",
  "name": "One Light",
  "appearance": "light",
  "tokens": {
    "background": "#fafafa",
    "backgroundSecondary": "#f0f0f0",
    "backgroundTertiary": "#dcdcdf",
    "surface": "#fafafa",
    "surfaceHover": "#e5e5e6",
    "surfaceActive": "#dcdcdf",
    "border": "#cacacc",
    "borderStrong": "#5e616b",
    "textPrimary": "#383a42",
    "textSecondary": "#5e616b",
    "textTertiary": "#5e616b",
    "textOnAccent": "#000000",
    "accent": "#4078f2",
    "accentHover": "#3c71e3",
    "accentSurface": "#dcdcdf",
    "focusRing": "#3f77f0",
    "error": "#e45649",
    "errorSurface": "#fafafa",
    "success": "#50a14f",
    "successSurface": "#fafafa",
    "warning": "#c18401",
    "warningSurface": "#fafafa",
    "info": "#0184bc",
    "infoSurface": "#fafafa",
    "backdrop": "#f0f0f0b3",
    "shadow": "#00000040",
    "folder": "#4078f2",
    "fileImage": "#50a14f",
    "fileVideo": "#986801",
    "fileAudio": "#a626a4",
    "fileCode": "#0184bc",
    "fileArchive": "#c18401",
    "filePdf": "#e45649",
    "fileText": "#5e616b",
    "previewCheckerboardLight": "#fafafa",
    "previewCheckerboardDark": "#dcdcdf"
  }
}
