{
  "$schema": "./theme.schema.json",
  "schemaVersion": 1,
  "id": "gruvbox-dark",
  "name": "Gruvbox Dark",
  "appearance": "dark",
  "tokens": {
    "background": "#282828",
    "backgroundSecondary": "#1d2021",
    "backgroundTertiary": "#3c3836",
    "surface": "#282828",
    "surfaceHover": "#32302f",
    "surfaceActive": "#3c3836",
    "border": "#59554a",
    "borderStrong": "#aea08d",
    "textPrimary": "#ebdbb2",
    "textSecondary": "#aea08d",
    "textTertiary": "#aea08d",
    "textOnAccent": "#000000",
    "accent": "#fabd2f",
    "accentHover": "#ebb22c",
    "accentSurface": "#3c3836",
    "focusRing": "#fabd2f",
    "error": "#fb4934",
    "errorSurface": "#282828",
    "success": "#b8bb26",
    "successSurface": "#282828",
    "warning": "#fabd2f",
    "warningSurface": "#282828",
    "info": "#83a598",
    "infoSurface": "#282828",
    "backdrop": "#1d2021b3",
    "shadow": "#00000040",
    "folder": "#fabd2f",
    "fileImage": "#b8bb26",
    "fileVideo": "#fe8019",
    "fileAudio": "#d3869b",
    "fileCode": "#83a598",
    "fileArchive": "#fabd2f",
    "filePdf": "#fb4934",
    "fileText": "#aea08d",
    "previewCheckerboardLight": "#32302f",
    "previewCheckerboardDark": "#282828"
  }
}
