{
  "$schema": "./theme.schema.json",
  "schemaVersion": 1,
  "id": "everforest-light",
  "name": "Everforest Light",
  "appearance": "light",
  "tokens": {
    "background": "#fdf6e3",
    "backgroundSecondary": "#efebd4",
    "backgroundTertiary": "#e6e2cc",
    "surface": "#fdf6e3",
    "surfaceHover": "#f4f0d9",
    "surfaceActive": "#e6e2cc",
    "border": "#d4d2c6",
    "borderStrong": "#5c675c",
    "textPrimary": "#58666d",
    "textSecondary": "#5c675c",
    "textTertiary": "#5c675c",
    "textOnAccent": "#000000",
    "accent": "#8da101",
    "accentHover": "#859701",
    "accentSurface": "#e6e2cc",
    "focusRing": "#768701",
    "error": "#f85552",
    "errorSurface": "#fdf6e3",
    "success": "#8da101",
    "successSurface": "#fdf6e3",
    "warning": "#dfa000",
    "warningSurface": "#fdf6e3",
    "info": "#3a94c5",
    "infoSurface": "#fdf6e3",
    "backdrop": "#efebd4b3",
    "shadow": "#00000040",
    "folder": "#8da101",
    "fileImage": "#8da101",
    "fileVideo": "#f57d26",
    "fileAudio": "#df69ba",
    "fileCode": "#3a94c5",
    "fileArchive": "#dfa000",
    "filePdf": "#f85552",
    "fileText": "#5c675c",
    "previewCheckerboardLight": "#fdf6e3",
    "previewCheckerboardDark": "#e6e2cc"
  }
}
