{
  "$schema": "./theme.schema.json",
  "schemaVersion": 1,
  "id": "kanagawa-dragon",
  "name": "Kanagawa Dragon",
  "appearance": "dark",
  "tokens": {
    "background": "#181616",
    "backgroundSecondary": "#12120f",
    "backgroundTertiary": "#393836",
    "surface": "#181616",
    "surfaceHover": "#282727",
    "surfaceActive": "#393836",
    "border": "#434342",
    "borderStrong": "#a6a69c",
    "textPrimary": "#c5c9c5",
    "textSecondary": "#a6a69c",
    "textTertiary": "#a6a69c",
    "textOnAccent": "#000000",
    "accent": "#8992a7",
    "accentHover": "#81899d",
    "accentSurface": "#393836",
    "focusRing": "#8992a7",
    "error": "#c4746e",
    "errorSurface": "#181616",
    "success": "#87a987",
    "successSurface": "#181616",
    "warning": "#c4b28a",
    "warningSurface": "#181616",
    "info": "#8ba4b0",
    "infoSurface": "#181616",
    "backdrop": "#12120fb3",
    "shadow": "#00000040",
    "folder": "#8992a7",
    "fileImage": "#87a987",
    "fileVideo": "#b6927b",
    "fileAudio": "#a292a3",
    "fileCode": "#8ba4b0",
    "fileArchive": "#c4b28a",
    "filePdf": "#c4746e",
    "fileText": "#a6a69c",
    "previewCheckerboardLight": "#282727",
    "previewCheckerboardDark": "#181616"
  }
}
