{
  "$schema": "./theme.schema.json",
  "schemaVersion": 1,
  "id": "catppuccin-latte",
  "name": "Catppuccin Latte",
  "appearance": "light",
  "tokens": {
    "background": "#eff1f5",
    "backgroundSecondary": "#e6e9ef",
    "backgroundTertiary": "#dce0e8",
    "surface": "#eff1f5",
    "surfaceHover": "#e6e9ef",
    "surfaceActive": "#dce0e8",
    "border": "#acb0be",
    "borderStrong": "#6c6f85",
    "textPrimary": "#4c4f69",
    "textSecondary": "#5c5f77",
    "textTertiary": "#5c5f77",
    "textOnAccent": "#eff1f5",
    "accent": "#8839ef",
    "accentHover": "#8839ef",
    "accentSurface": "#ccd0da",
    "focusRing": "#8839ef",
    "error": "#d20f39",
    "errorSurface": "#eff1f5",
    "success": "#40a02b",
    "successSurface": "#eff1f5",
    "warning": "#df8e1d",
    "warningSurface": "#eff1f5",
    "info": "#1e66f5",
    "infoSurface": "#eff1f5",
    "backdrop": "#dce0e8b3",
    "shadow": "#dce0e840",
    "folder": "#8839ef",
    "fileImage": "#40a02b",
    "fileVideo": "#fe640b",
    "fileAudio": "#ea76cb",
    "fileCode": "#1e66f5",
    "fileArchive": "#df8e1d",
    "filePdf": "#d20f39",
    "fileText": "#5c5f77",
    "previewCheckerboardLight": "#eff1f5",
    "previewCheckerboardDark": "#ccd0da"
  }
}
