{
  "$schema": "./theme.schema.json",
  "schemaVersion": 1,
  "id": "rose-pine-dawn",
  "name": "Ros\u00e9 Pine Dawn",
  "appearance": "light",
  "tokens": {
    "background": "#faf4ed",
    "backgroundSecondary": "#fffaf3",
    "backgroundTertiary": "#f2e9e1",
    "surface": "#faf4ed",
    "surfaceHover": "#f2e9e1",
    "surfaceActive": "#f2e9e1",
    "border": "#cdc8ca",
    "borderStrong": "#6a6781",
    "textPrimary": "#464261",
    "textSecondary": "#6a6781",
    "textTertiary": "#6a6781",
    "textOnAccent": "#000000",
    "accent": "#907aa9",
    "accentHover": "#87739f",
    "accentSurface": "#f2e9e1",
    "focusRing": "#907aa9",
    "error": "#b4637a",
    "errorSurface": "#faf4ed",
    "success": "#286983",
    "successSurface": "#faf4ed",
    "warning": "#ea9d34",
    "warningSurface": "#faf4ed",
    "info": "#56949f",
    "infoSurface": "#faf4ed",
    "backdrop": "#fffaf3b3",
    "shadow": "#00000040",
    "folder": "#907aa9",
    "fileImage": "#286983",
    "fileVideo": "#d7827e",
    "fileAudio": "#907aa9",
    "fileCode": "#56949f",
    "fileArchive": "#ea9d34",
    "filePdf": "#b4637a",
    "fileText": "#6a6781",
    "previewCheckerboardLight": "#faf4ed",
    "previewCheckerboardDark": "#f2e9e1"
  }
}
