{
  "$schema": "./theme.schema.json",
  "schemaVersion": 1,
  "id": "kanagawa-lotus",
  "name": "Kanagawa Lotus",
  "appearance": "light",
  "tokens": {
    "background": "#f2ecbc",
    "backgroundSecondary": "#d5cea3",
    "backgroundTertiary": "#e5ddb0",
    "surface": "#f2ecbc",
    "surfaceHover": "#dcd5ac",
    "surfaceActive": "#e5ddb0",
    "border": "#cac6a6",
    "borderStrong": "#59574d",
    "textPrimary": "#545464",
    "textSecondary": "#59574d",
    "textTertiary": "#59574d",
    "textOnAccent": "#ffffff",
    "accent": "#624c83",
    "accentHover": "#6b578a",
    "accentSurface": "#e5ddb0",
    "focusRing": "#624c83",
    "error": "#c84053",
    "errorSurface": "#f2ecbc",
    "success": "#6f894e",
    "successSurface": "#f2ecbc",
    "warning": "#77713f",
    "warningSurface": "#f2ecbc",
    "info": "#4d699b",
    "infoSurface": "#f2ecbc",
    "backdrop": "#d5cea3b3",
    "shadow": "#00000040",
    "folder": "#624c83",
    "fileImage": "#6f894e",
    "fileVideo": "#cc6d00",
    "fileAudio": "#b35b79",
    "fileCode": "#4d699b",
    "fileArchive": "#77713f",
    "filePdf": "#c84053",
    "fileText": "#59574d",
    "previewCheckerboardLight": "#f2ecbc",
    "previewCheckerboardDark": "#e5ddb0"
  }
}
