{
  "$schema": "./theme.schema.json",
  "schemaVersion": 1,
  "id": "gruvbox-light",
  "name": "Gruvbox Light",
  "appearance": "light",
  "tokens": {
    "background": "#fbf1c7",
    "backgroundSecondary": "#f2e5bc",
    "backgroundTertiary": "#d5c4a1",
    "surface": "#fbf1c7",
    "surfaceHover": "#ebdbb2",
    "surfaceActive": "#d5c4a1",
    "border": "#cbc3a3",
    "borderStrong": "#5b5149",
    "textPrimary": "#3c3836",
    "textSecondary": "#5b5149",
    "textTertiary": "#5b5149",
    "textOnAccent": "#ffffff",
    "accent": "#af3a03",
    "accentHover": "#b44612",
    "accentSurface": "#d5c4a1",
    "focusRing": "#af3a03",
    "error": "#9d0006",
    "errorSurface": "#fbf1c7",
    "success": "#79740e",
    "successSurface": "#fbf1c7",
    "warning": "#b57614",
    "warningSurface": "#fbf1c7",
    "info": "#076678",
    "infoSurface": "#fbf1c7",
    "backdrop": "#f2e5bcb3",
    "shadow": "#00000040",
    "folder": "#af3a03",
    "fileImage": "#79740e",
    "fileVideo": "#af3a03",
    "fileAudio": "#8f3f71",
    "fileCode": "#076678",
    "fileArchive": "#b57614",
    "filePdf": "#9d0006",
    "fileText": "#5b5149",
    "previewCheckerboardLight": "#fbf1c7",
    "previewCheckerboardDark": "#d5c4a1"
  }
}
