{
  "$schema": "./theme.schema.json",
  "schemaVersion": 1,
  "id": "rose-pine-main",
  "name": "Ros\u00e9 Pine Main",
  "appearance": "dark",
  "tokens": {
    "background": "#191724",
    "backgroundSecondary": "#1f1d2e",
    "backgroundTertiary": "#26233a",
    "surface": "#191724",
    "surfaceHover": "#26233a",
    "surfaceActive": "#26233a",
    "border": "#4b4958",
    "borderStrong": "#908caa",
    "textPrimary": "#e0def4",
    "textSecondary": "#908caa",
    "textTertiary": "#908caa",
    "textOnAccent": "#000000",
    "accent": "#c4a7e7",
    "accentHover": "#b89dd9",
    "accentSurface": "#26233a",
    "focusRing": "#c4a7e7",
    "error": "#eb6f92",
    "errorSurface": "#191724",
    "success": "#31748f",
    "successSurface": "#191724",
    "warning": "#f6c177",
    "warningSurface": "#191724",
    "info": "#9ccfd8",
    "infoSurface": "#191724",
    "backdrop": "#1f1d2eb3",
    "shadow": "#00000040",
    "folder": "#c4a7e7",
    "fileImage": "#31748f",
    "fileVideo": "#ebbcba",
    "fileAudio": "#c4a7e7",
    "fileCode": "#9ccfd8",
    "fileArchive": "#f6c177",
    "filePdf": "#eb6f92",
    "fileText": "#908caa",
    "previewCheckerboardLight": "#26233a",
    "previewCheckerboardDark": "#191724"
  }
}
