{
  "$schema": "./theme.schema.json",
  "schemaVersion": 1,
  "id": "catppuccin-mocha",
  "name": "Catppuccin Mocha",
  "appearance": "dark",
  "tokens": {
    "background": "#1e1e2e",
    "backgroundSecondary": "#181825",
    "backgroundTertiary": "#11111b",
    "surface": "#1e1e2e",
    "surfaceHover": "#181825",
    "surfaceActive": "#11111b",
    "border": "#585b70",
    "borderStrong": "#a6adc8",
    "textPrimary": "#cdd6f4",
    "textSecondary": "#bac2de",
    "textTertiary": "#bac2de",
    "textOnAccent": "#11111b",
    "accent": "#cba6f7",
    "accentHover": "#cba6f7",
    "accentSurface": "#313244",
    "focusRing": "#cba6f7",
    "error": "#f38ba8",
    "errorSurface": "#1e1e2e",
    "success": "#a6e3a1",
    "successSurface": "#1e1e2e",
    "warning": "#f9e2af",
    "warningSurface": "#1e1e2e",
    "info": "#89b4fa",
    "infoSurface": "#1e1e2e",
    "backdrop": "#11111bb3",
    "shadow": "#11111b40",
    "folder": "#cba6f7",
    "fileImage": "#a6e3a1",
    "fileVideo": "#fab387",
    "fileAudio": "#f5c2e7",
    "fileCode": "#89b4fa",
    "fileArchive": "#f9e2af",
    "filePdf": "#f38ba8",
    "fileText": "#bac2de",
    "previewCheckerboardLight": "#1e1e2e",
    "previewCheckerboardDark": "#313244"
  }
}
