{
  "$schema": "./theme.schema.json",
  "schemaVersion": 1,
  "id": "tokyo-night-storm",
  "name": "Tokyo Night Storm",
  "appearance": "dark",
  "tokens": {
    "background": "#24283b",
    "backgroundSecondary": "#1f2335",
    "backgroundTertiary": "#3b4261",
    "surface": "#24283b",
    "surfaceHover": "#292e42",
    "surfaceActive": "#3b4261",
    "border": "#4b506a",
    "borderStrong": "#a9b1d6",
    "textPrimary": "#c0caf5",
    "textSecondary": "#a9b1d6",
    "textTertiary": "#a9b1d6",
    "textOnAccent": "#000000",
    "accent": "#7aa2f7",
    "accentHover": "#7398e8",
    "accentSurface": "#3b4261",
    "focusRing": "#7aa2f7",
    "error": "#f7768e",
    "errorSurface": "#24283b",
    "success": "#9ece6a",
    "successSurface": "#24283b",
    "warning": "#e0af68",
    "warningSurface": "#24283b",
    "info": "#7dcfff",
    "infoSurface": "#24283b",
    "backdrop": "#1f2335b3",
    "shadow": "#00000040",
    "folder": "#7aa2f7",
    "fileImage": "#9ece6a",
    "fileVideo": "#ff9e64",
    "fileAudio": "#bb9af7",
    "fileCode": "#7dcfff",
    "fileArchive": "#e0af68",
    "filePdf": "#f7768e",
    "fileText": "#a9b1d6",
    "previewCheckerboardLight": "#292e42",
    "previewCheckerboardDark": "#24283b"
  }
}
