{
  "$schema": "./theme.schema.json",
  "schemaVersion": 1,
  "id": "github-dark-default",
  "name": "GitHub Dark Default",
  "appearance": "dark",
  "tokens": {
    "background": "#0d1117",
    "backgroundSecondary": "#161b22",
    "backgroundTertiary": "#30363d",
    "surface": "#0d1117",
    "surfaceHover": "#161b22",
    "surfaceActive": "#30363d",
    "border": "#43484e",
    "borderStrong": "#989fa7",
    "textPrimary": "#e6edf3",
    "textSecondary": "#989fa7",
    "textTertiary": "#989fa7",
    "textOnAccent": "#000000",
    "accent": "#2f81f7",
    "accentHover": "#2c79e8",
    "accentSurface": "#30363d",
    "focusRing": "#2f81f7",
    "error": "#f85149",
    "errorSurface": "#0d1117",
    "success": "#3fb950",
    "successSurface": "#0d1117",
    "warning": "#d29922",
    "warningSurface": "#0d1117",
    "info": "#2f81f7",
    "infoSurface": "#0d1117",
    "backdrop": "#161b22b3",
    "shadow": "#00000040",
    "folder": "#2f81f7",
    "fileImage": "#3fb950",
    "fileVideo": "#f0883e",
    "fileAudio": "#bc8cff",
    "fileCode": "#2f81f7",
    "fileArchive": "#d29922",
    "filePdf": "#f85149",
    "fileText": "#989fa7",
    "previewCheckerboardLight": "#161b22",
    "previewCheckerboardDark": "#0d1117"
  }
}
