{
  "$schema": "./theme.schema.json",
  "schemaVersion": 1,
  "id": "kanagawa-wave",
  "name": "Kanagawa Wave",
  "appearance": "dark",
  "tokens": {
    "background": "#1f1f28",
    "backgroundSecondary": "#16161d",
    "backgroundTertiary": "#363646",
    "surface": "#1f1f28",
    "surfaceHover": "#2a2a37",
    "surfaceActive": "#363646",
    "border": "#4e4d4c",
    "borderStrong": "#c8c093",
    "textPrimary": "#dcd7ba",
    "textSecondary": "#c8c093",
    "textTertiary": "#c8c093",
    "textOnAccent": "#000000",
    "accent": "#957fb8",
    "accentHover": "#8c77ad",
    "accentSurface": "#363646",
    "focusRing": "#957fb8",
    "error": "#e82424",
    "errorSurface": "#1f1f28",
    "success": "#98bb6c",
    "successSurface": "#1f1f28",
    "warning": "#e6c384",
    "warningSurface": "#1f1f28",
    "info": "#7e9cd8",
    "infoSurface": "#1f1f28",
    "backdrop": "#16161db3",
    "shadow": "#00000040",
    "folder": "#957fb8",
    "fileImage": "#98bb6c",
    "fileVideo": "#ffa066",
    "fileAudio": "#d27e99",
    "fileCode": "#7e9cd8",
    "fileArchive": "#e6c384",
    "filePdf": "#e82424",
    "fileText": "#c8c093",
    "previewCheckerboardLight": "#2a2a37",
    "previewCheckerboardDark": "#1f1f28"
  }
}
