{
  "$schema": "./theme.schema.json",
  "schemaVersion": 1,
  "id": "tokyo-night-moon",
  "name": "Tokyo Night Moon",
  "appearance": "dark",
  "tokens": {
    "background": "#222436",
    "backgroundSecondary": "#1e2030",
    "backgroundTertiary": "#3b4261",
    "surface": "#222436",
    "surfaceHover": "#2f334d",
    "surfaceActive": "#3b4261",
    "border": "#4c5066",
    "borderStrong": "#a9afce",
    "textPrimary": "#c8d3f5",
    "textSecondary": "#a9afce",
    "textTertiary": "#a9afce",
    "textOnAccent": "#000000",
    "accent": "#82aaff",
    "accentHover": "#7aa0f0",
    "accentSurface": "#3b4261",
    "focusRing": "#82aaff",
    "error": "#ff757f",
    "errorSurface": "#222436",
    "success": "#c3e88d",
    "successSurface": "#222436",
    "warning": "#ffc777",
    "warningSurface": "#222436",
    "info": "#86e1fc",
    "infoSurface": "#222436",
    "backdrop": "#1e2030b3",
    "shadow": "#00000040",
    "folder": "#82aaff",
    "fileImage": "#c3e88d",
    "fileVideo": "#ff966c",
    "fileAudio": "#c099ff",
    "fileCode": "#86e1fc",
    "fileArchive": "#ffc777",
    "filePdf": "#ff757f",
    "fileText": "#a9afce",
    "previewCheckerboardLight": "#2f334d",
    "previewCheckerboardDark": "#222436"
  }
}
