{
  "$schema": "./theme.schema.json",
  "schemaVersion": 1,
  "id": "everforest-dark",
  "name": "Everforest Dark",
  "appearance": "dark",
  "tokens": {
    "background": "#2d353b",
    "backgroundSecondary": "#232a2e",
    "backgroundTertiary": "#3d484d",
    "surface": "#2d353b",
    "surfaceHover": "#343f44",
    "surfaceActive": "#3d484d",
    "border": "#565957",
    "borderStrong": "#acb6ae",
    "textPrimary": "#d3c6aa",
    "textSecondary": "#acb6ae",
    "textTertiary": "#acb6ae",
    "textOnAccent": "#000000",
    "accent": "#a7c080",
    "accentHover": "#9db478",
    "accentSurface": "#3d484d",
    "focusRing": "#a7c080",
    "error": "#e67e80",
    "errorSurface": "#2d353b",
    "success": "#a7c080",
    "successSurface": "#2d353b",
    "warning": "#dbbc7f",
    "warningSurface": "#2d353b",
    "info": "#7fbbb3",
    "infoSurface": "#2d353b",
    "backdrop": "#232a2eb3",
    "shadow": "#00000040",
    "folder": "#a7c080",
    "fileImage": "#a7c080",
    "fileVideo": "#e69875",
    "fileAudio": "#d699b6",
    "fileCode": "#7fbbb3",
    "fileArchive": "#dbbc7f",
    "filePdf": "#e67e80",
    "fileText": "#acb6ae",
    "previewCheckerboardLight": "#343f44",
    "previewCheckerboardDark": "#2d353b"
  }
}
