{
  "$schema": "./theme.schema.json",
  "schemaVersion": 1,
  "id": "rose-pine-moon",
  "name": "Ros\u00e9 Pine Moon",
  "appearance": "dark",
  "tokens": {
    "background": "#232136",
    "backgroundSecondary": "#2a273f",
    "backgroundTertiary": "#393552",
    "surface": "#232136",
    "surfaceHover": "#393552",
    "surfaceActive": "#393552",
    "border": "#525066",
    "borderStrong": "#a3a0b8",
    "textPrimary": "#e0def4",
    "textSecondary": "#a3a0b8",
    "textTertiary": "#a3a0b8",
    "textOnAccent": "#000000",
    "accent": "#c4a7e7",
    "accentHover": "#b89dd9",
    "accentSurface": "#393552",
    "focusRing": "#c4a7e7",
    "error": "#eb6f92",
    "errorSurface": "#232136",
    "success": "#3e8fb0",
    "successSurface": "#232136",
    "warning": "#f6c177",
    "warningSurface": "#232136",
    "info": "#9ccfd8",
    "infoSurface": "#232136",
    "backdrop": "#2a273fb3",
    "shadow": "#00000040",
    "folder": "#c4a7e7",
    "fileImage": "#3e8fb0",
    "fileVideo": "#ea9a97",
    "fileAudio": "#c4a7e7",
    "fileCode": "#9ccfd8",
    "fileArchive": "#f6c177",
    "filePdf": "#eb6f92",
    "fileText": "#a3a0b8",
    "previewCheckerboardLight": "#393552",
    "previewCheckerboardDark": "#232136"
  }
}
