{
  "$schema": "./theme.schema.json",
  "schemaVersion": 1,
  "id": "solarized-light",
  "name": "Solarized Light",
  "appearance": "light",
  "tokens": {
    "background": "#fdf6e3",
    "backgroundSecondary": "#eee8d5",
    "backgroundTertiary": "#e4ddca",
    "surface": "#fdf6e3",
    "surfaceHover": "#eee8d5",
    "surfaceActive": "#e4ddca",
    "border": "#d2d2c5",
    "borderStrong": "#53656b",
    "textPrimary": "#51656c",
    "textSecondary": "#53656b",
    "textTertiary": "#53656b",
    "textOnAccent": "#000000",
    "accent": "#268bd2",
    "accentHover": "#2483c5",
    "accentSurface": "#e4ddca",
    "focusRing": "#2483c5",
    "error": "#dc322f",
    "errorSurface": "#fdf6e3",
    "success": "#859900",
    "successSurface": "#fdf6e3",
    "warning": "#b58900",
    "warningSurface": "#fdf6e3",
    "info": "#268bd2",
    "infoSurface": "#fdf6e3",
    "backdrop": "#eee8d5b3",
    "shadow": "#00000040",
    "folder": "#268bd2",
    "fileImage": "#859900",
    "fileVideo": "#cb4b16",
    "fileAudio": "#6c71c4",
    "fileCode": "#268bd2",
    "fileArchive": "#b58900",
    "filePdf": "#dc322f",
    "fileText": "#53656b",
    "previewCheckerboardLight": "#fdf6e3",
    "previewCheckerboardDark": "#e4ddca"
  }
}
