{
  "$schema": "./theme.schema.json",
  "schemaVersion": 1,
  "id": "github-light-default",
  "name": "GitHub Light Default",
  "appearance": "light",
  "tokens": {
    "background": "#ffffff",
    "backgroundSecondary": "#f6f8fa",
    "backgroundTertiary": "#d0d7de",
    "surface": "#ffffff",
    "surfaceHover": "#f6f8fa",
    "surfaceActive": "#d0d7de",
    "border": "#c7c8c9",
    "borderStrong": "#575e65",
    "textPrimary": "#1f2328",
    "textSecondary": "#575e65",
    "textTertiary": "#575e65",
    "textOnAccent": "#ffffff",
    "accent": "#0969da",
    "accentHover": "#1872dc",
    "accentSurface": "#d0d7de",
    "focusRing": "#0969da",
    "error": "#cf222e",
    "errorSurface": "#ffffff",
    "success": "#1f883d",
    "successSurface": "#ffffff",
    "warning": "#9a6700",
    "warningSurface": "#ffffff",
    "info": "#0969da",
    "infoSurface": "#ffffff",
    "backdrop": "#f6f8fab3",
    "shadow": "#00000040",
    "folder": "#0969da",
    "fileImage": "#1f883d",
    "fileVideo": "#bc4c00",
    "fileAudio": "#8250df",
    "fileCode": "#0969da",
    "fileArchive": "#9a6700",
    "filePdf": "#cf222e",
    "fileText": "#575e65",
    "previewCheckerboardLight": "#ffffff",
    "previewCheckerboardDark": "#d0d7de"
  }
}
