{
  "$schema": "./theme.schema.json",
  "schemaVersion": 1,
  "id": "tokyo-night-day",
  "name": "Tokyo Night Day",
  "appearance": "light",
  "tokens": {
    "background": "#e1e2e7",
    "backgroundSecondary": "#d0d5e3",
    "backgroundTertiary": "#b7c1e3",
    "surface": "#e1e2e7",
    "surfaceHover": "#c4c8da",
    "surfaceActive": "#b7c1e3",
    "border": "#b4bcd3",
    "borderStrong": "#424e78",
    "textPrimary": "#2b4c97",
    "textSecondary": "#424e78",
    "textTertiary": "#424e78",
    "textOnAccent": "#000000",
    "accent": "#2e7de9",
    "accentHover": "#2b76db",
    "accentSurface": "#b7c1e3",
    "focusRing": "#2769c4",
    "error": "#f52a65",
    "errorSurface": "#e1e2e7",
    "success": "#587539",
    "successSurface": "#e1e2e7",
    "warning": "#8c6c3e",
    "warningSurface": "#e1e2e7",
    "info": "#007197",
    "infoSurface": "#e1e2e7",
    "backdrop": "#d0d5e3b3",
    "shadow": "#00000040",
    "folder": "#2e7de9",
    "fileImage": "#587539",
    "fileVideo": "#b15c00",
    "fileAudio": "#9854f1",
    "fileCode": "#007197",
    "fileArchive": "#8c6c3e",
    "filePdf": "#f52a65",
    "fileText": "#424e78",
    "previewCheckerboardLight": "#e1e2e7",
    "previewCheckerboardDark": "#b7c1e3"
  }
}
